domain,author name,bio,topics
allthingsdistributed.com,Werner Vogels,CTO of Amazon,"cloud computing, technology, software development"
tedgioia.substack.com,Ted Gioia,Music historian and author,"music, culture, history"
chrisstucchio.com,Chris Stucchio,Software developer and data scientist,"data science, software development, technology"
penny-arcade.com,Michael Krahulik and Jerry Holkins,Authors and illustrators,"gaming, comics, culture"
chiark.greenend.org.uk,Ian Jackson,Software developer and Debian contributor,"Debian, open source, software development"
deepsouthventures.com,Peter Askew,Domain name enthusiast,"entrepreneurship, domain names, onions"
cfenollosa.com,Carlos Fenollosa,Software developer and entrepreneur,"startups, software development, technology"
greenwald.substack.com,Glenn Greenwald,Journalist and author,"politics, journalism, civil liberties"
nicole.express,Nicole Caroline Branagan,Software developer and retro computing enthusiast,"retro computing, programming, technology"
alexellis.io,Alex Ellis,Software developer and creator of OpenFaaS,"serverless, Kubernetes, software development"
windytan.com,Salli Anttonen,Software developer and radio enthusiast,"radio technology, programming, software development"
robinsloan.com,Robin Sloan,Author and media inventor,"writing, technology, media"
matduggan.com,Mat Duggan,Writer and blogger,"writing, technology, culture"
matt-rickard.com,Matt Rickard,Software developer and entrepreneur,"programming, software development, technology"
scotthelme.co.uk,Scott Helme,Security researcher and blogger,"security, cryptography, software development"
alexanderell.is,Alexander Ellis,Software developer and blogger,"programming, software development, technology"
quirksmode.org,Peter-Paul Koch,Web developer and author,"web development, JavaScript, CSS"
blog.alexmaccaw.com,Alex MacCaw,Software developer and entrepreneur,"programming, software development, startups"
eugeneyan.com,Eugen Yan,Data scientist and writer,"data science, machine learning, technology"
thurrott.com,Paul Thurrott,Technology journalist and blogger,"technology, software, reviews"
moxie.org,Moxie Marlinspike,Founder of Signal,"privacy, cryptography, technology"
blogmaverick.com,Mark Cuban,Entrepreneur and investor,"business, technology, entrepreneurship"
deprocrastination.co,Niklas Goeke,Writer and blogger,"productivity, personal development, writing"
palant.info,Wladimir Palant,Software developer and creator of Adblock Plus,"security, privacy, software development"
raganwald.com,Reginald Braithwaite,Software developer and author,"programming, software development, technology"
ludic.mataroa.blog,Nikhil Suresh,Developer and podcaster,""
nee.lv,Andris Reinman,Software developer and blogger,"programming, software development, technology"
underjord.io,Marcus Olsson,Software developer and writer,"programming, software development, technology"
datagenetics.com,Nick Berry,Data scientist and blogger,"data science, mathematics, statistics"
austinhenley.com,Austin Henley,Software developer and researcher,"programming, software development, research"
igvita.com,Ilya Grigorik,Software developer and performance engineer,"web performance, programming, technology"
humbledmba.com,Jason Freedman,Founder of 42Floors and partner at Peak State Ventures,""
startupclass.samaltman.com,Sam Altman,Founder of OpenAI,"startups, technology, entrepreneurship"
corecursive.com,Adam Gordon Bell,Software developer and podcast host,"programming, software development, technology"
dkb.io,Derek Banas,Software developer and educator,"programming, software development, education"
datagubbe.se,Carl Svensson,Software developer and writer,"data science, programming, technology"
feld.com,Brad Feld,Entrepreneur and venture capitalist,"startups, technology, entrepreneurship"
joearms.github.io,Joe Armstrong,Co-creator of Erlang,"programming, Erlang, software development"
dmitry.gr,Dmitry Grinberg,Hardware and software hacker,"hardware, programming, software development"
blog.wesleyac.com,Wesley Aptekar-Cassels,Software developer and blogger,"programming, software development, technology"
brainpickings.org,Maria Popova,Writer and blogger,"literature, culture, philosophy"
antonz.org,Anton Zhiyanov,Software developer and blogger,"programming, software development, technology"
daedtech.com,Erik Dietrich,Software developer and consultant,"programming, software development, consulting"
taibbi.substack.com,Matt Taibbi,Journalist and author,"politics, journalism, culture"
mattkeeter.com,Matt Keeter,Software developer and researcher,"programming, software development, technology"
ianbicking.org,Ian Bicking,Software developer and open source advocate,"programming, open source, software development"
stitcher.io,Brent Roose,Software developer and writer,"PHP, programming, software development"
idiallo.com,Idris Diallo,Software developer and blogger,"programming, software development, technology"
os.phil-opp.com,Philipp Oppermann,OS developer,"operating systems, Rust, software development"
ntietz.com,Nicole Tietz-Sokolskaya,,
krausefx.com,Felix Krause,Creator of fastlane,"iOS development, automation, open source"
lcamtuf.blogspot.com,Michal Zalewski,Security researcher and author,"security, programming, research"
taylor.town,Taylor Otwell,Creator of Laravel,"web development, PHP, Laravel"
hintjens.com,Pieter Hintjens,Co-founder of ZeroMQ and free software activist,"free software, euthanasia"
caseyhandmer.wordpress.com,Casey Handmer,Physicist and space enthusiast,"space exploration, technology, engineering"
michael.stapelberg.ch,Michael Stapelberg,Software developer,"software development, Linux, open source"
abe-winter.github.io,Abe Winter,Software engineer and writer,"software development, technology, essays"
rubenerd.com,Ruben Schade,Writer and podcaster,"technology, personal, media"
ma.tt,Matt Mullenweg,Co-founder of WordPress,"technology, open source, entrepreneurship"
nolanlawson.com,Nolan Lawson,Web developer and open-source contributor,"web development, performance, PWA"
tyler.io,Tyler Hall,Software developer,"software development, technology, personal"
jameshfisher.com,James Fisher,Software engineer and writer,"software development, security, essays"
fortressofdoors.com,Keith Burgun,Game designer and writer,"game design, philosophy, art"
anishathalye.com,Anish Athalye,Computer scientist,"machine learning, security, software engineering"
onstartups.com,Dharmesh Shah,Co-founder of HubSpot,"startups, entrepreneurship, technology"
juliareda.eu,Julia Reda,Former Member of the European Parliament,"digital rights, copyright, politics"
constructionphysics.substack.com,Brian Potter,Engineer and writer,"construction, engineering, technology"
zserge.com,Sergey,Software developer,"web development, programming, open source"
unchartedterritories.tomaspueyo.com,Tomas Pueyo,Author and public speaker,"psychology, social dynamics, technology"
ignorethecode.net,Ralf Rottmann,Entrepreneur and writer,"usability, design, technology"
bryanbraun.com,Bryan Braun,Software developer,"web development, open source, personal projects"
anvaka.github.io,Nikita Vasilenko,Software developer,"data visualization, open source, programming"
neugierig.org,Mike West,Web standards advocate,"web security, privacy, standards"
samcurry.net,Sam Curry,Security researcher,"cybersecurity, hacking, research"
blog.nuclearsecrecy.com,Alex Wellerstein,Historian of science,"nuclear history, policy, technology"
thehftguy.com,Anonymous,,
pagetable.com,Michael Steil,Software engineer and historian,"retro computing, software, hardware"
whattofix.com,Daniel Markham,,
flowingdata.com,Nathan Yau,Statistician and data visualization expert,"data visualization, statistics, design"
ma.ttias.be,Mattias Geniar,System administrator and developer,"system administration, web development, security"
jakearchibald.com,Jake Archibald,Developer advocate at Google,"web development, performance, service workers"
bradfrost.com,Brad Frost,Web designer and author,"web design, atomic design, front-end development"
macwright.com,Tom MacWright,Software developer and writer,"web development, mapping, open source"
agner.org,Agner Fog,Software developer and researcher,"software optimization, microarchitecture, programming"
yehudakatz.com,Yehuda Katz,JavaScript developer and open-source contributor,"JavaScript, Ruby, open source"
blog.chriszacharias.com,Chris Zacharias,Web developer and former YouTube engineer,"web development, technology, personal projects"
susam.net,Susam Pal,Software engineer and writer,"software development, mathematics, puzzles"
www-cs-faculty.stanford.edu,Donald Knuth,Computer scientist and professor,"algorithms, programming, computer science"
wordsandbuttons.online,Sergei Tikhomirov,Software developer and writer,"programming, mathematics, puzzles"
thecodist.com,Greg Brown,Software developer and writer,"software development, technology, personal projects"
fgiesen.wordpress.com,Fabian Giesen,Software engineer,"graphics programming, game development, technology"
thorstenball.com,Thorsten Ball,Software developer and author,"programming languages, interpreters, compilers"
garymarcus.substack.com,Gary Marcus,"Cognitive scientist, author, and entrepreneur","AI, cognitive science, technology"
tylercipriani.com,Tyler Cipriani,"Developer and open-source advocate","software engineering, open-source, technology"
thechipletter.substack.com,Anonymous,"Anonymous tech enthusiast","technology, computer chips, hardware"
thebignewsletter.com,Matt Stoller,Antitrust advocate and author,"politics, monopolies"
ounapuu.ee,Herman Õunapuu,Programmer and digital archivist,"self-hosting, computer hardware, Linux"
practical.engineering,Grady Hillhouse,"Civil engineer and educator","engineering, infrastructure, education"
paulbutler.org,Paul Butler,"Software engineer and data visualizer","data visualization, software engineering, technology"
wheresyoured.at,Ed Zitron,CEO of EZPR,
samwho.dev,Sam Rose,"Developer and writer","software engineering, programming, technology"
jonathanhaidt.substack.com,Jonathan Haidt,"Social psychologist and author","psychology, society, culture"
borretti.me,Fernando Borretti,Developer and programming language author,"software development, personal projects, programming languages"
construction-physics.com,Brian Potter,"Engineer and writer","construction, engineering, physics"
abortretry.fail,Bradford Morgan White,,"vintage software"
dataswamp.org/~solene,Solène Rapenne,"Developer and open-source contributor","open-source, software development, technology"
artemis.sh,artemis everfree,,"technology, software, personal projects"
admiralcloudberg.medium.com,Kyra Dempsey,Plane crash analyst,"aviation, incident analysis"
tidyfirst.substack.com,Kent Beck,Software developer and author,"software development, refactoring"
baldurbjarnason.com,Baldur Bjarnason,Researcher and writer,"technology, media, publishing"
notes.alinpanaitiu.com,Alin Panaitiu,Developer and writer,"software development, productivity"
masteringemacs.org,Mickey Petersen,Emacs enthusiast and writer,"Emacs, text editors, productivity"
viewfromthewing.com,Gary Leff,Travel expert and writer,"travel, frequent flyer programs"
micahlerner.com,Micah Lerner,Software engineer and writer,"software development, technology"
vadimkravcenko.com,Vadim Kravcenko,Software developer and writer,"software development, technology"
lunduke.locals.com,Bryan Lunduke,Technology journalist and podcaster,"technology, open source"
two-wrongs.com,Christoffer Stjernlöf,,
cabel.com,Cabel Sasser,Co-founder of Panic Inc. and writer,"software development, entrepreneurship"
kerkour.com,Guillaume Kerkour,Security researcher and writer,"security, software development"
jacobbartlett.substack.com,Jacob Bartlett,Writer and analyst,"technology, society, culture"
willempennings.nl,Willem Pennings,Engineer and inventor,"engineering, DIY projects"
herman.bearblog.dev,Herman Martinus,Developer and writer,"software development, technology"
file770.com,Mike Glyer,Sci-fi enthusiast,"books, sci-fi"
experimentalhistory.substack.com,Devon Zuegel,Writer and software developer,"history, technology, society"
blog.brixit.nl,Martijn Braam,,"linux, electronics"
downtowndougbrown.com,Doug Brown,Writer and urban planner,"urban planning, development"
aisnakeoil.substack.com,Meredith Broussard,Journalist and data scientist,"AI, technology, society"
robkhenderson.substack.com,Rob Henderson,Social psychologist and writer,"psychology, society, culture"
doctorow.medium.com,Cory Doctorow,Author and activist,"technology, privacy, society"
themarginalian.org,Maria Popova,Writer and curator,"literature, philosophy, art"
edwardsnowden.substack.com,Edward Snowden,Whistleblower and privacy advocate,"privacy, technology, society"
lucasfcosta.com,Lucas F. Costa,Software engineer and writer,"software development, testing"
connortumbleson.com,Connor Tumbleson,Software developer and writer,"software development, open source"
bbycroft.net,Benjamin Bycroft,Software engineer and writer,"software development, technology"
axleos.com,Phillip Tennen,Hobby OS developer,"os development"
onemileatatime.com,Ben Schlappig,Travel expert and blogger,"travel, frequent flyer programs"
sofuckingagile.com,Anonymous,,"enterprise SaaS, mental health, product management, sales"
amazingcto.com,Stephan Schmidt,CTO coach and author,"coaching"
domain,author name,bio,topics
laplab.me,Nikita Lapkov,"Developer and Database expert","databases, performance, SQL"
3blue1brown.com,Grant Sanderson,Mathematician and educator,"mathematics, visualizations, education"
noahpinion.blog,Noah Smith,Economist and writer,"economics, technology, policy"
clivethompson.medium.com,Clive Thompson,Journalist and author,"technology, culture, science"
jakeseliger.com,Jake Seliger,Writer and researcher,"writing, essays, research"
alexwlchan.net,Alex Chan,Developer and writer,"software engineering, technology, productivity"
specbranch.com,Nima Badizadegan,Software and hardware developer,"engineering practices, randomness, performance"
slowboring.com,Matthew Yglesias,Journalist and writer,"politics, economics, policy"
jakelazaroff.com,Jake Lazaroff,Developer and writer,"software engineering, personal projects, technology"
brickexperimentchannel.wordpress.com,Anonymous,Software engineer and Lego enthusiast,"legos"
seths.blog,Seth Godin,Author and marketer,"marketing, business, personal development"
jenson.org,Scott Jenson,,"ux"
ianthehenry.com,Ian Henry,Entrepreneur and writer,"startups, technology, personal growth"
bitecode.dev,Anonymous,,"python"
raymii.org,Remy van Elst,System administrator and writer,"linux, security, open source"
hixie.ch,Ian Hickson,Software engineer,"web standards, technology, software development"
tech.marksblogg.com,Mark Litwintschik,Developer and data engineer,"big data, cloud computing, technology"
newsletter.mollywhite.net,Molly White,Software engineer and writer,"cryptocurrency, technology, web3"
jakobgreenfeld.com,Jakob Greenfeld,Entrepreneur and writer,"startups, marketing, technology"
astralcodexten.com,Scott Alexander,Psychiatrist and blogger,"rationalism, psychology, culture"
andreinc.net,Andrei Nicusan,Developer and writer,"software engineering, personal projects, technology"
thomask.sdf.org,Thomas K,Developer and writer,"software engineering, open source, technology"
charlespetzold.com,Charles Petzold,Author and programmer,"programming, technology, computer science"
httptoolkit.com,Tim Perry,Author of HTTP Toolkit,"http protocol, standards, TLS"
maxread.substack.com,Max Read,Writer and editor,"media, technology, culture"
neelc.org,Neel Chauhan,Developer and writer,"open source, software engineering, personal projects"
da.vidbuchanan.co.uk,David Buchanan,Developer and writer,"security, software engineering, personal projects"
gabrielsieben.tech,Gabriel Sieben,Developer and writer,"software engineering, personal projects, technology"
mayerowitz.io,Antoine Mayerowitz,Economist and data scientist,"data, interactivity, art"
netmeister.org,Jan Schaumann,Engineer and writer,"networking, security, technology"
lynalden.com,Lyn Alden,Investment strategist and writer,"investing, economics, finance"
ayende.com,Oren Eini,Developer and founder of RavenDB,"software development, databases, NoSQL"
philip.greenspun.com,Philip Greenspun,MIT professor and photographer,"photography, technology, aviation"
rhaas.blogspot.com,Robert Haas,PostgreSQL major contributor and database expert,"PostgreSQL, databases, open source"
craigmod.com,Craig Mod,Writer and photographer,"technology, books, travel"
beepb00p.xyz,Karli Coss,Developer,
effectiviology.com,Itamar Shatz,,"psychology, philosophy"
tim.blog,Tim Ferriss,Author and entrepreneur,"productivity, lifestyle design, self-improvement"
baremetrics.com,Josh Pigford,Founder of Baremetrics,"SaaS, analytics, entrepreneurship"
henrikkarlsson.xyz,Henrik Karlsson,Independent developer and writer,"technology, software development"
resobscura.substack.com,Erik Wade,Writer and historian,"history, culture"
chrisbuilds.github.io,Chris,Developer and builder,"software development, projects"
stefantheard.com,Stefan Heard,Developer and consultant,"web development, technology"
roytanck.com,Roy Tanck,Developer and designer,"web development, design"
jamesbvaughan.com,James B. Vaughan,Photographer,"photography, travel"
without.boats,Anonymous,Developer and writer,"software development, personal essays"
cs.cmu.edu/~wkw,Weng-Keen Wong,,
read.engineerscodex.com,Leonardo Creed,,
amygoodchild.com,Amy Goodchild,Artist and writer,"art, creativity"
dannorth.net,Dan North,Consultant and developer,"software development, consulting"
nothinghuman.substack.com,Ivan Vendrov,,
insiderockstarnorth.blogspot.com,Obbe Vermeij,,
olano.dev,Facundo Olano,Developer,"software development, technology"
andreasjhkarlsson.github.io,Andreas J.H. Karlsson,Developer,"software development, projects"
prolost.com,Stu Maschwitz,Filmmaker and visual effects artist,"filmmaking, visual effects"
honest-broker.com,Noah Smith,Economist and writer,"economics, policy"
dotat.at,Tony Finch,Developer,"software development, technology"
vgel.me,Theia Vogel,,
dropofahat.zone,James Steinberg,,"hat dropping, computer vision"
awesomekling.substack.com,Andreas Kling,Developer and writer,"software development, personal essays"
chriscoyier.net,Chris Coyier,Designer and developer,"web design, CSS, HTML"
downfall.page,Daniel Moghimi,,"vulnerability research"
bernsteinbear.com,Max Bernstein,,
eloquentjavascript.net,Marijn Haverbeke,Developer and author,"JavaScript, programming"
eieio.games,Nolen Royalty,HTML artist,
bessey.dev,Matt Bessey,Software developer,
dunfield.themindfactory.com,Dave Dunfield,Systems engineer,
alexmolas.com,Alex Molas,Developer and writer,"software development, technology"
predr.ag,Predrag Gruevski,,
blogsystem5.substack.com,Julio Merino,,"operating systems, build systems, programming languages"
jackpoulson.substack.com,Jack Poulson,Researcher and writer,"technology, policy"
papereditor.app,Mihhail Lapushkin,,
ericdraken.com,Eric Draken,Developer,"software development, technology"
difftastic.wilfred.me.uk,Wilfred Hughes,Developer,"software development, tools"
suanto.com,Antti Suanto,Data Architect,
cep.dev,Jack Lindamood,Software engineer,N/A
blog.0x7d0.dev,Anonymous,,"security, reverse engineering"
matan-h.com,Matan H,Developer and writer,"software development, personal essays"
sherprog.com,Anne Gunn,Independent software founder,,
char.gd,Owen Williams,,
bitfieldconsulting.com,John Arundel,,
garrit.xyz,Garrit Franke,,"devops, open-source software"
saurabhs.org,Saurabh,,
engraved.blog,Jonas Degrave,Research Scientist at Deepmind,"machine learning, llms"
anthonyhobday.com,Anthony Hobday,Designer and writer,"design, user interfaces, writing"
rwmj.wordpress.com,Richard W.M. Jones,Software engineer and open source contributor,"virtualization, Linux, open source"
magazine.sebastianraschka.com,Sebastian Raschka,Machine learning researcher and author,"machine learning, data science, Python"
computerenhance.com,Casey Muratori,Independent video game developer,"programming education, game development"
ratfactor.com,Dave Gauer,,
ploum.net,Ploum,Author and blogger,"technology, society, personal reflections"
githubcopilotinvestigation.com,Matthew Butterick,Lawyer and typograhy designer,"open-source, llms, legal"
maggieappleton.com,Maggie Appleton,Designer and illustrator,"design, visual explanations, digital gardens"
darrellowens.substack.com,Darrell Owens,Urban policy writer,"urban policy, housing, transportation"
mitchellh.com,Mitchell Hashimoto,Co-founder of HashiCorp,"infrastructure, automation, open source"
kentnerburn.com,Kent Nerburn,Author,"spirituality, Native American culture, personal reflections"
verdagon.dev,Evan Ovadia,Software architect and lead of the Vale Programming Language,"programming languages, open-source, llms"
blog.cr.yp.to,Daniel J. Bernstein,Cryptographer,"security, cryptography"
dkb.blog,Dmitri Brereton,,"ai, search engines"
platformer.news,Casey Newton,Independent tech journalist,
coryd.dev,Cory Doctorow,Author and activist,"technology, copyright, digital rights"
fathy.fr,Fathy Boundjadj,Software Engineer,
build-your-own.org,James Smith,Independent technical author,"go, compilers, redis"
vickiboykis.com,Vicki Boykis,Data scientist and writer,"data science, technology, personal reflections"
geohot.github.io,George Hotz,Hacker and entrepreneur,"technology, hacking, AI"
xdavidhu.me,David Schütz,,
jaykmody.com,Jay K Mody,Software engineer,"software engineering, security, programming"
bedelstein.com,Ben Edelstein,,
keith-mcnulty.medium.com,Keith McNulty,Data scientist and author,"data science, psychology, human resources"
boyter.org,Ben Boyter,Developer,"search engines, programming, software development"
sophiajt.com,Sophia June Turner,,
ansel.photos,Aurelien Pierre,Photographer and creator of Ansel,,
rednafi.com,Redowan Delowar,,
aras-p.info,Aras Pranckevičius,Game developer,"game development, unity, demoscene"
blog.paavo.me,Paavo Huhtala,,
calculusmadeeasy.org,Silvanus P. Thompson,,
catskull.net,Anonymous,,"html, css"
practicalbetterments.com,Nathaniel,,"productivity, life hacks"
frantic.im,Alex Kotliarskyi,Software Engineer and co-founder of Secta AI,,
virtuallyfun.com,neozeed,,
pboyd.io,Paul Boyd,,
tontinton.com,Tony Solomonik,,
statecraft.beehiiv.com,Arman Madani,,
mcyoung.xyz,Miguel Young de la Sota,,
j3s.sh,Jes Olson,,
charity.wtf,Charity Majors,,
orlp.net,Orson R. L. Peters,,
danilafe.com,Danila Fedorin,,
bitbashing.io,Dan Luu,Engineer and blogger,"technology, software, hardware"
andrewkchan.dev,Andrew Chan,Software developer and blogger,"programming, technology"
experimental-history.com,Devon Zuegel,Writer and software engineer,"history, technology, urban planning"
michaelgeist.ca,Michael Geist,Law professor and digital rights advocate,"technology law, digital rights, privacy"
explainextended.com,Quassnoi,SQL expert and blogger,"SQL, database optimization, programming"
davidrevoy.com,David Revoy,Artist and open-source advocate,"digital art, open-source software, tutorials"
fromjason.xyz,Jason Lengstorf,Developer and educator,"web development, productivity, career"
allenpike.com,Allen Pike,Software developer and entrepreneur,"software development, startups, technology"
soatok.blog,Soatok Dreamseeker,Security researcher and furry,"cryptography, security, technology"
dmytry.github.io,Dmytry Lavrov,,
mrbruh.com,Paul,Cybersecurity professional,"malware, security research"
tonybaloney.github.io,Anthony Shaw,Software developer at Microsoft,
solvingprocrastination.com,Nate Soares,Executive director of MIRI,"procrastination, productivity, self-improvement"
jameshaydon.github.io,James Haydon,,
danielchasehooper.com,Daniel Chase Hooper,Physicist and researcher,"physics, research, academia"
rknight.me,Ryan Knight,Software developer and blogger,"programming, technology, personal projects"
jamesg.blog,James G.,Software developer and blogger,"programming, technology, personal projects"
maphappenings.com,James Killick,Software developer and mapping technology expert,"maps"
mbuffett.com,Marcus Buffett,Indie developer,"chess, entrepreneurship"
rahulilango.com,Rahul Ilango,Software developer and blogger,"programming, technology, personal projects"
addyosmani.com,Addy Osmani,Engineering manager at Google,"web performance, JavaScript, open-source"
tylervigen.com,Tyler Vigen,Data scientist and author,"statistics, data analysis, humor"
codeconfessions.substack.com,Abhinav Upadhyay,,"compilers, programming languages, databases"
shreyans.org,Shreyans Bhansali,,
robindev.substack.com,Robin Dev,,
dubroy.com,Patrick Dubroy,Software engineer and blogger,"programming, technology, personal projects"
chrislewicki.com,Chris Lewicki,Aerospace engineer and entrepreneur,"space exploration, technology, entrepreneurship"
mfkl.github.io,Martin Finkel,VLC developer,"vlc, .net"
leanrada.com,Lean,Software engineer and artist,
robins.one,Taylor Robinson,Web developer and UI design enthusiast,
natesilver.net,Nate Silver,Statistician and writer,"statistics, politics, data analysis"
lexaloffle.com,Joseph White,Indie game developer,
whyevolutionistrue.com,Jerry Coyne,Professor and author,"evolution, biology, science"
onemillioncheckboxes.com,Nolen Royalty,HTML artist,
plbrault.com,Pier‑Luc Brault,Computer Science teacher at Cégep de Sherbrooke,
thomaskole.nl,Thomas Kole,Technical artist,,
cliffle.com,Cliff L. Biffle,Software developer and blogger,"programming, technology, personal projects"
futilitycloset.com,Greg Ross,Writer and editor,"trivia, history, puzzles"
jeanhsu.substack.com,Jean Hsu,Leadership coach and writer,"leadership, personal development, technology"
popovicu.com,Uros Popovic,Staff Software Engineer at Google,,
heathermeeker.com,Heather Meeker,Attorney and open-source advocate,"open-source software, legal issues, technology"
mattlakeman.org,Matt Lakeman,Writer and researcher,"self-improvement, productivity, personal development"
anandsanwal.me,Anand Sawal,,
