domain,author name,bio,topics
htmlhell.dev,Manuel Matuzović,,
curl.dev,Daniel Stenberg,Creator of cURL,"curl"
hezmatt.org,Matt Palmer,"Software engineer and open source enthusiast","software development, open source, personal projects"
agileotter.blogspot.com,Tim Ottinger,"Agile coach, author, and software developer","agile methodologies, software development, coaching"
paulbupejr.com,Paul Bupe Jr.,"Software engineer and blogger","software development, personal growth, technology"
cellio.dreamwidth.org,Monica Cellio,"Writer and community manager","writing, community management, personal thoughts"
hiandrewquinn.github.io,Andrew Quinn,"Software engineer and blogger","software development, personal projects, technology"
gvwilson.github.io,Greg Wilson,"Educator and software developer","software development, education, data science"
johnthenerd.com,John "The Nerd","Software developer and blogger","software development, personal projects, technology"
erikdemaine.org,Erik Demaine,"Professor of Computer Science at MIT, artist, and researcher","algorithms, computational origami, computer science"
dzombak.com,David Zombak,"Software engineer and writer","software engineering, personal projects, technology"
matthewstrom.com,Matthew Strom,"Designer and writer","design, user experience, personal projects"
chromakode.com,Max Ogden,"Software developer and open source advocate","open source, software development, personal projects"
10maurycy10.github.io,Maurycy,"Software developer and blogger","software development, personal projects, technology"
gmunk.com,Gmunk (Bradley Munkowitz),"Designer and director","design, visual effects, personal projects"
geoffreylitt.com,Geoffrey Litt,"Software developer and researcher","software development, human-computer interaction, personal projects"
ben.page,Ben Kuhn,"Software engineer and blogger","software development, personal projects, technology"
voussoir.net,Voussoir,"Artist and programmer","art, programming, personal projects"
dgroshev.com,Dmitry Groshev,"Software developer and blogger","software development, personal projects, technology"
catandgirl.com,Dorothy Gambrell,"Cartoonist and writer","comics, personal thoughts, humor"
512pixels.net,Stephen Hackett,"Writer and podcaster","Apple, technology, personal thoughts"
blog.ploeh.dk,Mark Seemann,"Software developer and author","software development, functional programming, personal projects"
maskray.me,Fangrui Song,"Software developer and blogger","software development, LLVM, personal projects"
alinpanaitiu.com,Alin Panaitiu,"Software developer and blogger","software development, personal projects, technology"
sandofsky.com,Benjamin Sandofsky,,
12challenges.substack.com,Louis,,
hugo.blog,Hugo Barra,,
axio.ms,Matt Evans,,
iter.ca,Anonymous,,
kmjn.org,Mark J. Nelson,Computer Science professor at American University,,
beyondloom.com,John Earnest,,
wiredjs.com,Preet Shihn,,
computerwebsite.net,Henry,,
linuxblog.io,Hayden James,Linux Systems Analyst,,
ellie.wtf,Ellie Huxtable,Software Engineer and founder of Atuin,,
coryzue.com,Cory Zue,Indie founder and software developer,"django, javascript, entrepreneurship"
lunchbag.ca,Jen Yip,Software developer and indie founder of Lunch Money,"entrepreneurship, customer service"
gleam.run,Louis Pilfold,,
bigmessowires.com,Steve Chamberlin,,"custom cpus, computer hardware"
blobstreaming.org,Mohamed Aboelez,,
a9.io,Max Krieger,,
byran.ee,Byran Huang,Indie laptop maker,"indie hardware, personal projects"
timsh.org,Tim Sh,Software developer and writer,"programming, technology, personal thoughts"
danielwirtz.com,Daniel Wirtz,Product designer and developer,"design, no-code tools, productivity"
seangoedecke.com,Sean Goedecke,Writer and software developer,"writing, programming, personal projects"
chadnauseam.com,Chad Nauseam,Writer and tech enthusiast,"technology, culture, personal essays"
haterade.substack.com,Haterade,Writer and cultural critic,"culture, media criticism, personal essays"
sergey.fyi,Sergey Mohov,Product designer and developer,"design, technology, personal projects"
th0mas.nl,Thomas van der Veen,Developer and tech enthusiast,"programming, technology, personal projects"
sockpuppet.org,Thomas Ptacek,Security researcher and entrepreneur,"security, cryptography, programming"
eliseomartelli.it,Eliseo Martelli,Developer and designer,"programming, design, technology"
ohdoylerules.com,Chris Doyle,Developer and tech enthusiast,"programming, technology, personal projects"
mertbulan.com,Mert Bulan,Software engineer,"programming, technology, personal projects"
kibty.town,Kibty,Writer and artist,"art, personal essays, creative projects"
marcan.st,Hector Martin,Security researcher and developer,"hardware hacking, reverse engineering, Linux"
timkellogg.me,Tim Kellogg,Software engineer,"programming, technology, personal projects"
grantslatton.com,Grant Slatton,Engineer and writer,"technology, programming, personal essays"
romanzipp.com,Roman Zipp,Developer and designer,"programming, design, technology"
gilesthomas.com,Giles Thomas,Developer and entrepreneur,"programming, technology, business"
substack.evancarroll.com,Evan Carroll,Writer and technologist,"technology, politics, personal essays"
weeks.ginatrapani.org,Gina Trapani,Writer and developer,"productivity, technology, personal life"
vinay.sh,Vinay Hiremath,Entrepreneur and developer,"technology, startups, programming"
chiark.greenend.org.uk/~sgtatham,Simon Tatham,Software developer and mathematician,"programming, puzzles, software tools"
bessstillman.substack.com,Bess Stillman,Writer and essayist,"culture, personal essays, literature"
amanvir.com,Amanvir Sangha,Developer and tech enthusiast,"programming, technology, personal projects"
crawshaw.io,David Crawshaw,Software engineer,"programming, databases, systems design"
crisesnotes.com,Crises,Writer and researcher,"technology, culture, personal essays"
chriskiehl.com,Chris Kiehl,Software engineer,"programming, technology, career advice"
danieldelaney.net,Daniel Delaney,Developer and writer,"programming, technology, personal projects"
hypercritical.co,John Siracusa,Writer and podcaster,"technology, Apple, media criticism"
insidemedicine.substack.com,Jeremy Faust,Physician and medical writer,"medicine, health, COVID-19"
kaseyhou.com,Kasey Hou,Designer and artist,"design, art, personal projects"
tintin.dlazaro.ca,David Lazaro,Developer and tech enthusiast,"programming, technology, personal projects"
vincentwoo.com,Vincent Woo,Developer and entrepreneur,"programming, technology, startups"
cs16.samke.me,Sam Ke,Computer science student,"programming, computer science, personal projects"
mattsayar.com,Matt Sayar,Developer and writer,"programming, technology, personal essays"
pippinbarr.com,Pippin Barr,Game designer and academic,"game design, art, experimental games"
blog.6nok.org,Fatih Altinok,Software engineer,"javascript, web development"
usher.dev,Usher Effendi,Software developer,"programming, technology, personal projects"
jazco.dev,Jaz Singh,Developer and tech enthusiast,"programming, technology, personal projects"
sagipolaczek.github.io,Sagi Polaczek,Developer and researcher,"programming, technology, personal projects"
p.migdal.pl,Piotr Migdał,Data scientist and researcher,"data science, machine learning, visualization"
nyanpasu64.gitlab.io,nyanpasu64,Developer and tech enthusiast,"programming, audio, technology"
andysblog.uk,Andy,Writer and tech enthusiast,"technology, personal essays, reviews"
brutecat.com,skull,Security researcher,"bug bounties, Google vulnerabilities"
keygen.sh,Zeke Gabrielse,Founder of Keygen,"indie business, software development"
okayfail.com,Phill Mendonça-Vieira,Software developer,"trans rights"
aresluna.org,Marcin Wichary,"Designer, writer, & typographer","typography"
practicapp.com,Robbe Derks,Hardware and software engineering consultant,"self-driving cars,hardware hacking"
blog.startifact.com,Martijn Faassen,Software developer,"rust, javascript, computer science"
purplesyringa.moe,Alisa Sireneva,,
walzr.com,Riley Walz,Blogger and digital performance artist,"public experiments,pranks"
jimmyhmiller.github.io,Jimmy Miller,Software developer and blogger,"software development,software horror stories"
conduition.io,Conduition,Pseudonymous cypherpunk,"cryptography, scriptless smart contracts, multi-party computation"
switowski.com,Sebastian Witowski,Independent Python consultant,"conferences, meetings, dev tools"
disruptionist.com,Matt Binder,Independent journalist,"politics, technology, internet culture"
