domain,author name,bio,topics
paulgraham.com,Paul Graham,"Co-founder of Y Combinator, entrepreneur, and essayist","startups, technology, essays"
krebsonsecurity.com,Brian Krebs,Independent journalist,"security, malware, fraud"
jvns.ca,Julia Evans,Developer and zine author,"linux, debugging, dns"
wizardzines.com,Julia Evans,Developer and zine author,"linux, debugging, dns"
danluu.com,Dan Luu,Engineer and writer,"hardware, software, performance"
daringfireball.net,John Gruber,Technology blogger,"Apple, technology, design"
stratechery.com,Ben Thompson,Technology analyst,"business, technology, media"
troyhunt.com,Troy Hunt,Security expert and instructor,"security, data breaches, web security"
kalzumeus.com,Patrick McKenzie,Developer and consultant,"product pricing, a-b testing, conversion optimization"
schneier.com,Bruce Schneier,Security technologist and author,"security, cryptography, privacy"
jacquesmattheij.com,Jacques Mattheij,Entrepreneur and technologist,"startups, technology, personal projects"
rachelbythebay.com,Rachel Kroll,Infrastructure engineer,"software engineering, personal experiences, technology"
shkspr.mobi,Terence Eden,Technology consultant and writer,"open data, technology, digital rights"
blog.samaltman.com,Sam Altman,Entrepreneur and investor,"startups, technology, economics"
marco.org,Marco Arment,Developer and podcaster,"technology, software development, podcasts"
simonwillison.net,Simon Willison,Developer and co-creator of Django,"software development, data journalism, AI"
codinghorror.com,Jeff Atwood,Developer and co-founder of Stack Overflow,"software development, coding practices, technology"
drewdevault.com,Drew DeVault,Developer and open-source advocate,"open-source, software development, technology"
tbray.org,Tim Bray,Technologist and writer,"technology, software development, XML"
sive.rs,Derek Sivers,Entrepreneur and author,"entrepreneurship, music, personal development"
ciechanow.ski,Bartosz Ciechanowski,Author of interactive articles,"physics, engineering, visualizations"
antirez.com,Salvatore Sanfilippo,Creator of Redis,"databases, open-source, software development"
fabiensanglard.net,Fabien Sanglard,Software developer and author,"game development, software engineering, retro computing"
daniel.haxx.se,Daniel Stenberg,Creator of cURL,"networking, open-source, software development"
jeffgeerling.com,Jeff Geerling,Developer and YouTube creator,"Raspberry Pi, Ansible, open-source"
gwern.net,Gwern Branwen,Researcher and writer,"psychology, statistics, technology"
steveblank.com,Steve Blank,Entrepreneur and educator,"startups, entrepreneurship, lean startup methodology"
jgc.org,John Graham-Cumming,CTO of Cloudflare,"programming, technology, history"
lemire.me,Daniel Lemire,Computer science professor,"algorithms, performance, data science"
hanselman.com,Scott Hanselman,Developer and speaker,"software development, productivity, technology"
martinfowler.com,Martin Fowler,Software development expert,"software architecture, refactoring, agile development"
johndcook.com,John D. Cook,Consultant and mathematician,"mathematics, statistics, software development"
gatesnotes.com,Bill Gates,Philanthropist and technologist,"global health, education, technology"
kottke.org,Jason Kottke,Blogger,"culture, technology, media"
devblogs.microsoft.com/oldnewthing,Raymond Chen,Veteran Microsoft engineer,"Windows development, programming, software history"
tonsky.me,Nikita Prokopov,Developer and designer,"software development, design, typography"
blog.acolyer.org,Adrian Colyer,Technology analyst,"computer science research, technology, software engineering"
antipope.org,Charles Stross,Science fiction author,"science fiction, technology, politics"
nullprogram.com,Chris Wellons,Software developer,"programming, emacs, software engineering"
slatestarcodex.com,Anonymous,Psychiatrist and blogger,"rationality, psychology, culture"
idlewords.com,Maciej Cegłowski,Developer and writer,"technology, culture, travel"
filfre.net,Jimmy Maher,Writer and historian,"computer history, interactive fiction, technology"
pluralistic.net,Cory Doctorow,Author and activist,"activism, technology, copyright"
brendangregg.com,Brendan Gregg,Performance engineer,"performance engineering, systems, technology"
scottaaronson.com,Scott Aaronson,Computer science professor,"quantum computing, theoretical computer science, philosophy"
mjg59.dreamwidth.org,Matthew Garrett,Security developer,"security, Linux, open-source"
mtlynch.io,Michael Lynch,Indie founder and s'mores enthusiast,"software engineering, entrepreneurship, homelab"
daemonology.net,Colin Percival,FreeBSD contributor and founder of Tarsnap,"security, backups, open-source"
joelonsoftware.com,Joel Spolsky,Software developer and entrepreneur,"software development, startups, project management"
blog.cryptographyengineering.com,Matthew Green,Cryptographer,"cryptography, security, privacy"
zachholman.com,Zach Holman,Developer and speaker,"software development, startups, GitHub"
prog21.dadgum.com,John Carmack,Game developer and co-founder of id Software,"software development, game development, technology"
worrydream.com,Bret Victor,Designer and engineer,"user interfaces, programming, technology"
bunniestudios.com,Andrew "Bunnie" Huang,Hacker and hardware developer,"hardware hacking, open-source, technology"
randomascii.wordpress.com,Bruce Dawson,Software developer,"programming, debugging, performance"
catonmat.net,Peteris Krumins,Developer and entrepreneur,"programming, productivity, technology"
apenwarr.ca,Avery Pennarun,CEO of Tailscale,"networking, software development, technology"
justine.lol,Justine Tunney,Software developer and creator of cosmopolitan libc,"programming, operating systems, technology"
dynomight.net,Anonymous,,"science, existential angst"
hillelwayne.com,Hillel Wayne,Consultant and author,"formal methods, software engineering, technology"
gabrielweinberg.com,Gabriel Weinberg,CEO of DuckDuckGo,"privacy, entrepreneurship, technology"
lucumr.pocoo.org,Armin Ronacher,Software developer and creator of Flask,"Python, open-source, software development"
acoup.blog,Bret Devereaux,Historian,"history, military history, culture"
matt.might.net,Matt Might,Computer science professor,"computer science, healthcare, technology"
xkcd.com,Randall Munroe,Cartoonist and author,"comics, science, technology"
asmartbear.com,Jason Cohen,Founder of WPEngine and Smart Bear,"startups, entrepreneurship, software development"
blog.regehr.org,John Regehr,Computer science professor,"compilers, software engineering, programming languages"
eli.thegreenplace.net,Eli Bendersky,Software developer,"programming, compilers, technology"
pragmaticengineer.com,Gergely Orosz,Software engineer,"software engineering, career development, technology"
marginalia.nu,Viktor Lofgren,Founder of Marginalia search engine,"web development, design, technology"
robertheaton.com,Robert Heaton,Software developer,"programming, security, technology"
robert.ocallahan.org,Robert O'Callahan,Software developer,"programming, debugging, technology"
buttondown.com/hillelwayne,Hillel Wayne,Consultant and author,"formal methods, software engineering, technology"
backreaction.blogspot.com,Sabine Hossenfelder,Theoretical physicist,"physics, science communication, research"
domain,author name,bio,topics
neal.fun,Neal Agarwal,Interactive web developer and designer,"web development, creative coding, interactive design"
ctrl.blog,Daniel Aleksandersen,Developer,"security, Windows, web browsers"
filippo.io,Filippo Valsorda,Security engineer and cryptographer,"security, cryptography, software engineering"
evanmiller.org,Evan Miller,Software developer and statistician,"software development, statistics, data analysis"
bellard.org,Fabrice Bellard,Software prodigy and creator of FFmpeg and QEMU,"software development, multimedia processing, emulation"
mattstoller.substack.com,Matt Stoller,Author and antitrust policy expert,"antitrust, politics, economy"
blog.fogus.me,Michael Fogus,Software developer and author,"functional programming, software development, Clojure"
yosefk.com,Yosef Mendelsohn,Software engineer and blogger,"software development, C++, programming languages"
astralcodexten.substack.com,Scott Alexander,Psychiatrist and prolific blogger,"psychology, medicine, rationalism"
blog.benjojo.co.uk,Ben Cox,Software engineer and infrastructure expert,"software development, infrastructure, networking"
norvig.com,Peter Norvig,Director of Research at Google and AI expert,"artificial intelligence, programming, research"
aphyr.com,Kyle Kingsbury,Distributed systems engineer and researcher,"distributed systems, databases, software engineering"
fasterthanli.me,Amos Wenger,Rust enthusiast and YouTube creator,"Rust programming, software development, programming languages"
brandur.org,Brandur Leach,Software engineer and writer,"software development, databases, infrastructure"
calnewport.com,Cal Newport,Computer science professor and author,"productivity, deep work, computer science"
aaronsw.com,Aaron Swartz,Internet activist and programmer,"internet freedom, programming, activism"
tedunangst.com,Ted Unangst,Software developer and OpenBSD contributor,"OpenBSD, software development, security"
dcurt.is,Dustin Curtis,Designer, writer, and entrepreneur,"design, technology, writing"
raganwald.posterous.com,Reginald Braithwaite,Software developer and author,"software development, functional programming, JavaScript"
jwz.org,Jamie Zawinski,Software developer and early Netscape engineer,"software development, technology, personal blog"
research.swtch.com,Russ Cox,Principal engineer at Google,"programming, software engineering, Go language"
cdixon.org,Chris Dixon,Investor and general partner at Andreessen Horowitz,"technology, startups, investing"
joshwcomeau.com,Josh W. Comeau,Software developer and educator,"web development, React, JavaScript"
jefftk.com,Jeff Kaufman,Software engineer and effective altruist,"effective altruism, software engineering, personal blog"
chris-granger.com,Chris Granger,Software developer and co-creator of Light Table,"software development, programming tools, personal blog"
blog.pinboard.in,Maciej Cegłowski,Founder of Pinboard and writer,"technology, privacy, internet culture"
betterexplained.com,Kalid Azad,Author and educator,"mathematics, education, software development"
dave.cheney.net,Dave Cheney,Software developer and Go programming expert,"Go language, software development, programming"
jsomers.net,James Somers,Writer and programmer,"writing, software development, technology"
matklad.github.io,Aleksandr Kladov,Software developer and Rust contributor,"Rust programming, software development, programming languages"
marginalrevolution.com,Tyler Cowen,Economist and professor,"economics, public policy, culture"
jlongster.com,James Long,Software developer and creator of Actual,"software development, JavaScript, personal finance"
stallman.org,Richard Stallman,Founder of the Free Software Foundation,"free software, GNU, activism"
stephendiehl.com,Stephen Diehl,Software developer and Haskell enthusiast,"Haskell, software development, programming languages"
ejohn.org,John Resig,Creator of jQuery and software developer,"JavaScript, web development, programming"
words.steveklabnik.com,Steve Klabnik,Software developer and Rust enthusiast,"Rust programming, software development, open-source"
craigkerstiens.com,Craig Kerstiens,Product manager and PostgreSQL advocate,"PostgreSQL, databases, software development"
lapcatsoftware.com,Chris Hanson,Software developer and consultant,"software development, macOS, iOS"
ascii.textfiles.com,Jason Scott,Archivist and historian,"digital preservation, history, technology"
minimaxir.com,Max Woolf,Data scientist and software developer,"data science, machine learning, software development"
kk.org,Kevin Kelly,Author and founding executive editor of Wired,"technology, future trends, culture"
blog.stephenwolfram.com,Stephen Wolfram,Computer scientist and entrepreneur,"computational science, software development, technology"
ben-evans.com,Benedict Evans,Technology analyst and consultant,"technology, mobile, media"
jacobian.org,Jacob Kaplan-Moss,Co-creator of Django and software developer,"Django, Python, software development"
writings.stephenwolfram.com,Stephen Wolfram,Computer scientist and entrepreneur,"computational science, software development, technology"
tedium.co,Ernie Smith,Writer and editor,"obscure history, technology, culture"
paulbuchheit.blogspot.com,Paul Buchheit,Creator of Gmail and startup investor,"technology, startups, software development"
benkuhn.net,Ben Kuhn,Software developer and effective altruist,"effective altruism, software development, technology"
scripting.com,Dave Winer,Software developer and blogging pioneer,"blogging, software development, technology"
raphlinus.github.io,Raph Levien,Software developer and font designer,"software development, typography, Rust programming"
oimo.io,saharan,,"physics, math, pixel art"
acko.net,Steven Wittens,Web developer and designer,"web development, design, graphics"
berthub.eu,Bert Hubert,Software developer and entrepreneur,"DNS, software development, technology"
lcamtuf.coredump.cx,Michał Zalewski,Security researcher and author,"security, software development, hacking"
swombat.com,Dan Shipper,Entrepreneur and writer,"startups, writing, technology"
benhoyt.com,Ben Hoyt,Software developer,"software development, Python, Go language"
blog.erratasec.com,Robert Graham,Security researcher,"security, hacking, technology"
journal.stuffwithstuff.com,Bob Nystrom,Software developer and author,"software development, programming languages, game development"
qntm.org,Sam Hughes,Writer and software developer,"science fiction, software development, technology"
web.eecs.utk.edu/~azh,Alvin Huang,Computer science professor,"computer science, research, education"
cringely.com,Robert X. Cringely,Technology journalist and author,"technology, startups, industry analysis"
ferd.ca,Ferdinand Beyer,Software developer,"Erlang, software development, programming languages"
defmacro.org,Slava Akhmechet,Developer and Co-founder of RethinkDB,"entrepreneurship, open-source"
jessfraz.com,Jessie Frazelle,Docker developer and co-founder of Oxide Computer Company,"containers, open-source, software development"
blog.jim-nielsen.com,Jim Nielsen,Web developer and designer,"web development, design, technology"
karpathy.github.io,Andrej Karpathy,AI researcher and educator,"artificial intelligence, deep learning, machine learning"
bothsidesofthetable.com,Mark Suster,Entrepreneur and venture capitalist,"startups, investing, entrepreneurship"
wingolog.org,Andy Wingo,Software developer and GNU Guile maintainer,"GNU Guile, software development, programming languages"
eev.ee,Evelyn Woods,Software developer and writer,"software development, games, personal blog"
overreacted.io,Dan Abramov,Software developer and React core team member,"React, JavaScript, web development"
randsinrepose.com,Michael Lopp,Engineering manager and author,"management, leadership, technology"
blog.robertelder.org,Robert Elder,Software developer and educator,"software development, programming, education"
terrytao.wordpress.com,Terence Tao,Mathematician and professor,"mathematics, education, research"
waxy.org,Andy Baio,Writer and technologist,"technology, culture, internet"
jeremykun.com,Jeremy Kun,Mathematician and writer,"mathematics, computer science, education"
ribbonfarm.com,Venkatesh Rao,Writer and consultant,"culture, technology, business"
devever.net,Alyssa Rosenzweig,Software developer and open-source advocate,"open-source, software development, technology"
ncase.me,Nicky Case,Interactive artist and game developer,"interactive storytelling, games, education"
folklore.org,Andy Hertzfeld,Software developer and original Macintosh team member,"Apple history, technology, personal stories"
commoncog.com,Commonplace,Writer and entrepreneur,"business, personal development, technology"
computer.rip,J.B. Crawford,DevOps consultant and writer,"computer history"
stavros.io,Stavros Korokithakis,Software developer and entrepreneur,"software development, startups, technology"
dilbert.com,Scott Adams,Cartoonist and writer,"comics, satire, business"
zwischenzugs.com,Anonymous,,"software engineering, business"
bhorowitz.com,Ben Horowitz,Entrepreneur and venture capitalist,"startups, entrepreneurship, investing"
rosenzweig.io,Alyssa Rosenzweig,Software developer and open-source advocate,"open-source, software development, technology"
solipsys.co.uk,Colin Wright,,"software, mathematics"
xeiaso.net,Xe Iaso,Software developer,"software development, Rust programming, Nix"
lcamtuf.substack.com,Michal Zalewski,Security researcher and author,"security, software development, hacking"
calpaterson.com,Cal Paterson,Software developer and writer,"software development, technology, personal blog"
thume.ca,Thume,Software developer,"software development, technology, personal blog"
tratt.net,Nicholas Tratt,Computer scientist and researcher,"programming languages, research, software development"
jepsen.io,Kyle Kingsbury,Distributed systems engineer and researcher,"distributed systems, databases, software engineering"
destroyallsoftware.com,Gary Bernhardt,Software developer and educator,"software development, testing, programming languages"
ianvisits.co.uk,Ian Mansfield,Blogger and historian,"London history, events, culture"
muratbuffalo.blogspot.com,Murat Demirbas,Computer science professor,"distributed systems, computer science, research"
jeffhuang.com,Jeff Huang,Computer science professor,"human-computer interaction, computer science, research"
stackdiary.com,Alex Ivanovs,,"technology, cybersecurity, privacy, AI"
phoboslab.org,Dominic Szablewski,Game developer and software engineer,"game development, software development, web technologies"
stevelosh.com,Steve Losh,Software developer,"software development, Vim, Python"
steve-yegge.blogspot.com,Steve Yegge,Software developer and writer,"software development, technology, personal blog"
paulstamatiou.com,Paul Stamatiou,Designer and photographer,"design, photography, technology"
patrickcollison.com,Patrick Collison,CEO of Stripe,"startups, technology, writing"
catb.org,Eric S. Raymond,Open-source advocate and author,"open-source, software development, technology"
beej.us,Brian "Beej" Hall,Software developer and educator,"network programming, software development, education"
domain,author name,bio,topics
begriffs.com,Tom Dale,Software developer and technical writer,"Haskell, PostgreSQL, web development"
overcomingbias.com,Robin Hanson,Economist and author,"economics, rationality, futurism"
raptitude.com,David Cain,Blogger and author,"personal development, mindfulness, philosophy"
redblobgames.com,Amit Patel,Game developer and blogger,"game development, algorithms, visualization"
al3x.net,Alex Payne,Software developer and writer,"technology, software development, culture"
complete.org,John Goerzen,Programmer and manager,"old technology, amateur radio, zfs"
timharford.com,Tim Harford,Economist and author,"economics, statistics, decision making"
awesomekling.github.io,Andreas Kling,Software developer and creator of SerenityOS,"operating systems, software development, programming"
blog.rongarret.info,Ron Garret,Software developer and entrepreneur,"technology, software development, artificial intelligence"
bitsaboutmoney.com,Patrick McKenzie,Developer and consultant,"credit cards, banking, fintech"
joeyh.name,Joey Hess,Software developer and Debian contributor,"open source, software development, Debian"
popehat.com,Ken White,Attorney and blogger,"law, free speech, culture"
quuxplusone.github.io,Arthur O'Dwyer,Software developer and author,"C++, programming, software development"
incoherency.co.uk,David Given,Software developer and blogger,"programming, software development, open source"
blog.haschek.at,Florian Haschek,Software developer and security researcher,"security, programming, web development"
uncrunched.com,Michael Arrington,Founder of TechCrunch and entrepreneur,"startups, technology, entrepreneurship"
imperialviolet.org,Adam Langley,Software engineer at Google,"security, cryptography, software development"
scottaaronson.blog,Scott Aaronson,Computer scientist and professor,"quantum computing, computer science, complexity theory"
sheddingbikes.com,Tom MacWright,Software developer and writer,"programming, software development, technology"
scattered-thoughts.net,Max Bittker,Software developer and artist,"programming, art, technology"
vitalik.ca,Vitalik Buterin,Co-founder of Ethereum,"cryptocurrency, blockchain, technology"
erikbern.com,Erik Bernhardsson,Software developer and entrepreneur,"machine learning, data science, software development"
madned.substack.com,Ned Utzig,Developer and gamer,"workplace culture, computer games, management"
lethain.com,Will Larson,Software engineer and author,"engineering management, software development, technology"
susanjfowler.com,Susan Fowler,Author and engineer,"software engineering, workplace culture, technology"
hackerfactor.com,Mark Seiden,Security consultant and researcher,"security, cryptography, hacking"
josephg.com,Joseph Gentle,Software developer and researcher,"collaborative software, programming, technology"
nibblestew.blogspot.com,Martin Cracauer,Software developer and blogger,"programming, software development, technology"
lock.cmpxchg8b.com,Matthew Garrett,Security developer and Linux contributor,"security, Linux, software development"
patrick-breyer.de,Patrick Breyer,Privacy activist and politician,"privacy, digital rights, politics"
brr.fyi,Paul Coldren,Researcher in Antarctica,"antarctica, low-bandwidth internet, research"
unixdigest.com,Anonymous,Software developer and Unix enthusiast,"Unix, software development, open source"
250bpm.com,Martin Sústrik,Software developer and author,"networking, software development, ZeroMQ"
brooker.co.za,Chris Brooker,Software developer and blogger,"software development, programming, technology"
blog.eladgil.com,Elad Gil,Entrepreneur and investor,"startups, technology, entrepreneurship"
danielmiessler.com,Daniel Miessler,Security researcher and writer,"security, technology, writing"
scottlocklin.wordpress.com,Scott Locklin,Physicist and data scientist,"data science, physics, technology"
tirania.org,Miguel de Icaza,Software developer and open source advocate,"open source, software development, technology"
zedshaw.com,Zed Shaw,Software developer and author,"programming, software development, technology"
homakov.blogspot.com,Egor Homakov,Security researcher and software developer,"security, programming, software development"
andrewkelley.me,Andrew Kelley,Software developer and creator of Zig,"programming, Zig, software development"
blog.dustinkirkland.com,Dustin Kirkland,Software engineer and product manager,"Linux, software development, technology"
linusakesson.net,Linus Åkesson,Software developer and chiptune musician,"programming, retro computing, chiptune"
johncarlosbaez.wordpress.com,John Carlos Baez,Mathematician and physicist,"mathematics, physics, category theory"
tinyprojects.dev,Niklas Elmqvist,Software developer and professor,"software development, programming, personal projects"
copetti.org,Fabio Copetti,Software developer and emulator enthusiast,"emulation, programming, retro computing"
twobithistory.org,Matt Farrell,Software developer and historian,"history of computing, programming, technology"
craigmurray.org.uk,Craig Murray,Former diplomat and human rights activist,"politics, human rights, transparency"
eatonphil.com,Phil Eaton,Software developer and writer,"distributed systems, databases, go"
mitxela.com,Anonymous,Electronics enthusiast and maker,"electronics, DIY, projects"
arp242.net,Martin Tournoij,Software developer and blogger,"programming, open source, technology"
graydon2.dreamwidth.org,Graydon Hoare,Software developer and creator of Rust,"programming, Rust, software development"
oldvcr.blogspot.com,Cameron Kaiser,Vintage computer enthusiast,"vintage computers, linux"
staltz.com,Andre Staltz,Software developer and creator of Cycle.js,"programming, JavaScript, software development"
rjlipton.wordpress.com,Richard Lipton,Computer scientist and professor,"theoretical computer science, algorithms, complexity theory"
mattwarren.org,Matt Warren,Software developer and performance enthusiast,".NET, performance, programming"
alexkras.com,Alex Kras,Software developer and blogger,"programming, software development, technology"
kurzweilai.net,Ray Kurzweil,Inventor and futurist,"futurism, technology, artificial intelligence"
justinobeirne.com,Justin O'Beirne,Cartographer and designer,"maps, cartography, design"
noahpinion.substack.com,Noah Smith,Economist and blogger,"economics, technology, policy"
probablydance.com,Anders Hejlsberg,Software developer and creator of TypeScript,"programming, TypeScript, software development"
martin.kleppmann.com,Martin Kleppmann,Software developer and author,"distributed systems, data engineering, software development"
nedbatchelder.com,Ned Batchelder,Software developer and Python enthusiast,"Python, software development, programming"
lunduke.substack.com,Bryan Lunduke,Software developer and Linux enthusiast,"Linux, open source, technology"
blogs.msdn.microsoft.com/oldnewthing,Raymond Chen,Software engineer at Microsoft,"Windows development, software history, programming"
falkvinge.net,Rick Falkvinge,Founder of the Pirate Party,"digital rights, privacy, politics"
perell.com,David Perell,Writer and educator,"writing, education, technology"
craftinginterpreters.com,Bob Nystrom,Software developer and author,"programming languages, interpreters, software development"
mattcutts.com,Matt Cutts,Software engineer and former head of Google Webspam,"SEO, technology, software development"
intuitiveexplanations.com,Tim Urban,Writer and blogger,"science, technology, humor"
mjtsai.com,Michael Tsai,Software developer and blogger,"macOS, programming, software development"
